{
  "task_id": "T-LOW-001",
  "title": "valid low",
  "density": "low",
  "stage": "executing",
  "status": "active",
  "first_executor": "executor-a",
  "current_owner": "executor-a",
  "evaluator": "evaluator-a",
  "source_stage_before_handoff": null,
  "last_active_stage": null,
  "goal": "Adjust a known API field",
  "scope": "small response shape change",
  "acceptance_criteria": ["field renamed"],
  "artifacts": {
    "triage": "artifacts/T-LOW-001/triage.md",
    "scope": null,
    "design": null,
    "plan": null,
    "execution": null,
    "verification": null,
    "review": null,
    "handoff": null,
    "task_packet": null
  },
  "triage_result": {
    "intent_type": "maintenance",
    "complexity_score": 2,
    "density_reasons": ["目标明确", "无需设计决策"],
    "routing_confidence": "high",
    "selected_workflow": "low",
    "required_stages": ["triaged", "executing", "verifying", "completed"],
    "verification_level": "optional",
    "scores": {
      "scope_breadth": 0,
      "requirement_clarity": 0,
      "design_uncertainty": 0,
      "state_recovery_need": 0,
      "validation_risk": 1,
      "coordination_complexity": 1
    },
    "hard_rules_triggered": [],
    "request_summary": "Rename one API response field",
    "workflow_path": ["triaged", "executing", "verifying", "completed"],
    "required_artifacts": ["triage", "execution", "verification"],
    "why_not_lower": "已经是最短闭环"
  },
  "action_layer": {
    "actions": [
      {
        "id": "a1",
        "title": "Rename response field",
        "description": "Update the known response key and dependent test",
        "status": "in_progress",
        "kind": "implementation",
        "owner": "executor",
        "stage": "executing",
        "depends_on": [],
        "produces": ["artifacts.execution"],
        "acceptance_signal": "response contains the new field",
        "source": "plan",
        "updated_at": "2026-04-19T16:00:00Z"
      }
    ],
    "current_action_id": "a1",
    "next_action_id": "a1"
  },
  "shared_context": {
    "task_summary": "Known API field rename",
    "acceptance_contract": ["Only the target field changes"],
    "current_focus": "Update the response field and tests"
  },
  "resume_context": {
    "resume_priority_used": null,
    "restored_from_artifacts": [],
    "resume_brief": "",
    "last_resume_at": null
  },
  "handoff_meta": {
    "handoff_version": "1",
    "handoff_status": "none",
    "handoff_source_stage": null,
    "handoff_for_role": null,
    "summary_path": null,
    "handoff_reason": null
  },
  "review_state": {
    "review_required": false,
    "review_cycle": 0
  },
  "verification_state": {
    "verification_required": false,
    "verification_level": "optional",
    "verification_cycle": 0,
    "last_verdict": null
  },
  "rebuild_info": {
    "state_rebuildable": true,
    "rebuild_sources": ["triage"]
  },
  "decision_log": [],
  "blockers": [],
  "risks": [],
  "next_action": "Rename response field",
  "last_event": "ACTION_STARTED",
  "repair_direction": null,
  "todo": [
    {
      "id": "a1",
      "text": "Rename response field",
      "status": "in_progress"
    }
  ]
}